link,title,time,time_parsed,text
https://pbgdpl.tuyenquang.gov.vn/tee/RH0DRju0607.shtml,Server Error,,2023-06-11 00:00:00+07:00,
https://giaoducthudo.giaoducthoidai.vn/fpt-schools-nhan-chung-chi-iso-quoc-te-danh-rieng-cho-giao-duc-62803.html,FPT Schools nhận chứng chỉ ISO quốc tế dành riêng cho giáo dục,2023-06-09,2023-06-11 00:00:00-06:00,"FPT Schools nhận chứng chỉ ISO quốc tế dành riêng cho giáo dục
(GDTĐ) - FPT Schools trở thành hệ thống trường phổ thông đầu tiên tại Việt Nam nhận chứng chỉ quốc tế ISO 21001:2018 dành riêng cho lĩnh vực giáo dục.
Hệ thống Trường Phổ thông FPT (FPT Schools) chính thức nhận chứng chỉ ISO 21001:2018 vào tháng 6/2023, sau hơn 1 năm kể từ thời điểm bắt đầu xây dựng tài liệu, ban hành, áp dụng tài liệu, đánh giá nội bộ và đánh giá chứng nhận.
ISO 21001:2018 là tiêu chuẩn quốc tế được phát triển bởi Tổ chức Tiêu chuẩn hóa Quốc tế (ISO). Khác với ISO 9001:2015 là tiêu chuẩn áp dụng đại trà cho tất cả các doanh nghiệp, tổ chức thuộc nhiều lĩnh vực khác nhau, ISO 21001:2018 được thiết kế và phát triển để cung cấp hệ thống quản lý chất lượng dành riêng cho lĩnh vực giáo dục.
Do vậy, ISO 21001:2018 sẽ có nhiều nguyên tắc, cách tiếp cận, yêu cầu và quy trình mang tính tập trung và sát với hoạt động của các tổ chức trong lĩnh vực giáo dục.
FPT Schools nhận chứng chỉ ISO quốc tế dành riêng cho giáo dục.
ISO 21001:2018 cũng là một trong các tiêu chuẩn của ISO giúp thực hiện mục tiêu thứ 4 trong 17 mục tiêu phát triển bền vững của Liên hiệp quốc về chất lượng giáo dục là: “Đảm bảo chất lượng giáo dục toàn diện, công bằng và thúc đẩy cơ hội học tập suốt đời cho tất cả mọi người”.
ISO 21001:2018 là tiêu chuẩn hữu ích cho các tổ chức giáo dục, cung cấp công cụ quản lý chung. Việc áp dụng tiêu chuẩn ISO 21001:2018 giúp tổ chức giáo dục nâng cao năng lực và uy tín trong việc cung cấp hệ thống giáo dục có chất lượng toàn diện và công bằng, cá nhân hóa việc học tập nhằm đáp ứng những nhu cầu của học sinh và các bên liên quan.
Trong đợt đánh giá đầu tiên, 100% trường thuộc FPT Schools tham gia đánh giá đã nhận chứng chỉ ISO 21001:2018, bao gồm Trường THPT FPT Hà Nội, Trường TH & THCS FPT Cầu Giấy, Trường THPT FPT Đà Nẵng, Trường TH & THCS FPT Đà Nẵng, Trường THPT FPT Quy Nhơn, Trường THPT FPT Cần Thơ.
Các trường còn lại trong cùng hệ thống do mới thành lập trong năm đầu, sẽ tiếp tục được đánh giá để nhận chứng chỉ này trong các đợt đánh giá tiếp theo.
Để nhận được chứng chỉ ISO 21001:2018, FPT Schools đã nghiêm túc thực hiện và áp dụng 11 nguyên tắc bao gồm: Tập trung vào người học và người thụ hưởng khác, Lãnh đạo có tầm nhìn xa, Sự tham gia và cam kết của các cá nhân, Cách tiếp cận theo đúng quy trình, Sự cải tiến không ngừng, Các quyết định có căn cứ, Trách nhiệm xã hội, Quản lý mối quan hệ giữa tổ chức với các bên quan tâm, Sự công bằng và minh bạch, Đạo đức trong giáo dục và Bảo mật và bảo vệ dữ liệu.
TS. Nguyễn Xuân Phong, Giám đốc điều hành FPT Schools cho biết: “Việc nhận chứng chỉ ISO 21001:2018 nằm trong chiến lược và hành động của FPT Schools nhằm hướng việc quản trị hệ thống theo những tiêu chuẩn quốc tế, từ đó đảm bảo cung cấp chất lượng giáo dục tốt nhất cho người học.
Cùng với đó, FPT Schools sẽ không ngừng tìm kiếm các cơ hội mới nhằm củng cố và nâng cao chất lượng giáo dục, đem đến những trải nghiệm học tập ngày càng tiên tiến cho học sinh thuộc Hệ thống Trường Phổ thông FPT trên toàn quốc”.
Bằng việc nhận chứng chỉ ISO 21001:2018, FPT Schools đã thể hiện nỗ lực mạnh mẽ của mình trong việc hướng tới trở thành hệ thống giáo dục ngày càng hoàn thiện và không ngừng cải tiến, khích lệ sự xuất sắc và đổi mới trên toàn hệ thống.
Thành lập vào năm 2013, Hệ thống Trường Phổ thông FPT (FPT Schools) gồm 3 cấp Tiểu học, Trung học cơ sở và Trung học phổ thông với nhiều cơ sở tại các tỉnh thành trên toàn quốc.
Với triết lý hành động “làm khác để làm tốt”, FPT Schools tiên phong kiến tạo trải nghiệm trưởng thành cho học sinh thông qua đào tạo kiến thức, kỹ năng và các cơ hội khám phá bản thân, hướng nghiệp trên quan điểm sáng tạo, thấu hiểu và dựa vào các nền tảng công nghệ giáo dục tiên tiến.
Song song với chương trình theo chuẩn Bộ Giáo dục và Đào tạo, FPT Schools tích hợp bổ sung các chương trình đào tạo quan trọng nhằm hướng tới sự phát triển toàn diện cho học sinh như ngoại ngữ, STEM, AI và Robotics, công nghệ, chương trình phát triển cá nhân toàn diện theo chuẩn kỹ năng thế kỷ 21 và các môn học mang bản sắc văn hóa Việt Nam.
Sau 10 năm hoạt động, FPT Schools đã có mặt tại Hà Nội, Đà Nẵng, Quy Nhơn, Cần Thơ, Bắc Ninh, Hải Phòng, và hai trường sẽ triển khai tại Bắc Giang và Hà Nam trong năm nay. Hệ thống Trường phổ thông FPT cũng có kế hoạch tiếp tục mở rộng hoạt động tại nhiều tỉnh thành trong những năm tới.
Gần 105.000 thí sinh tại 201 điểm thi trên địa bàn Hà Nội đã hoàn thành bài thi môn Ngữ văn và Ngoại ngữ - hai trong số ba bài thi của kỳ thi tuyển sinh lớp 10 trung học phổ thông công lập không chuyên năm học 2023-2024.
Khói từ hàng trăm vụ cháy rừng đang bùng phát ở Canada đã tràn sang Na Uy và dự kiến sẽ tấn công miền Nam châu Âu trong vài ngày tới. Trước đó, hàng chục bang tại Mỹ đã phải ban bố cảnh báo về sức khoẻ do cháy rừng tại quốc gia láng giềng.
Phản ứng trước việc Ủy ban đối ngoại Thượng viện Mỹ thông qua Dự luật hủy bỏ tư cách “quốc gia đang phát triển” của Trung Quốc - động thái được cho là sẽ làm căng thẳng thêm mối quan hệ song phương, Bắc Kinh gọi đây là “lá bài” nhằm kiềm chế sự phát triển của Trung Quốc."
https://baoquangninh.vn/nhay-viec-anh-huong-den-suc-khoe-tinh-than-cua-gen-z-nhu-nao-3244102.html,"
Nhảy việc ảnh hưởng đến sức khỏe tinh thần của gen Z như nào? ",2023-06-11,2023-06-11 00:00:00-06:00,"Nhảy việc ảnh hưởng đến sức khỏe tinh thần của gen Z như nào?
“Thế hệ nhảy việc” là một tên gọi được gắn cho các nhân sự gen Z bởi khác với gen X và Y, gen Z không chỉ thay đổi công việc nhiều hơn mà lý do ẩn đằng sau việc đó cũng vô cùng đặc biệt. Chuyện gen Z nhảy việc liên quan gì đến sức khỏe tinh thần?
Nhảy việc vì không đủ hạnh phúc.
Nhảy việc là cụm từ chỉ hành động thay đổi công việc này sang công việc khác trong một thời gian ngắn (dưới 1 năm). Hiện tượng này khá phổ biến ở giới trẻ hiện nay và nó đã có những tác động nhất định không chỉ đối với cá nhân mà còn ảnh hưởng đến xã hội.
Những lý do liên quan đến vấn đề nhảy việc của gen Z thường được đưa ra đó là: cá tính mạnh, không lắng nghe và tiếp thu ý kiến, ảo tưởng năng lực bản thân... Tuy nhiên một sự thật mà cần nhìn nhận đó là gen Z có thể nghỉ việc vì họ không đủ hạnh phúc trong môi trường làm việc đó.
Gen Z mang đến một làn sóng mới trong thị trường lao động.
Thanh Ngân, sinh viên năm 2, Đại học Thương Mại đã từng nhảy việc nhiều lần bởi môi trường làm việc không thích hợp. “Tôi cảm thấy sợ hãi mỗi khi phải thức dậy và đi làm. Nghĩ đến việc đến một môi trường làm việc với nhiều sự soi mói, thảo mai và tôi luôn phải gồng mình khiến tôi cảm thấy kiệt sức” - Thanh Ngân chia sẻ.
Môi trường làm việc có tốt hay không, không chỉ xuất phát từ yếu tố công việc mà còn cần kể đến những nhu cầu thiết yếu trong đời sống như: nơi đỗ xe, chỗ nghỉ trưa, nơi giải trí, thư giãn... cũng là một yếu tố tác động đến chỉ số hạnh phúc cho thế hệ nhân sự gen Z.
Đỗ Phong, sinh viên năm 3, Đại học FPT chia sẻ: “Mình đi làm khá nhiều nơi và một trong số những tiêu chí lựa chọn công việc chính là môi trường công ty có đầy đủ những trang thiết bị và không gian phục vụ nhân sự khi nghỉ ngơi, thư giãn. Thật khó để làm việc văn phòng liên tục 8 tiếng trong một nơi khiến bạn không thấy thoải mái”.
Những nhu cầu cơ bản trong cuộc sống là nền tảng tạo nên sự hạnh phúc cho con người. Đa số ai cũng sẽ làm việc ⅔ cuộc đời và đó cũng là lý do dễ hiểu khi gen Z nhảy việc vì họ không đủ hạnh phúc trong môi trường làm việc đó.
Người làm ""sếp"" nghĩ sao về chuyện nhảy việc và sức khỏe tinh thần của nhân viên?
Một số ý kiến thường được đưa ra khi đề cập đến hai chữ “nhảy việc” đó là: “Cố gắng làm 2 năm đi rồi nhảy việc”, “Nhảy việc nhiều sẽ khiến hồ sơ xấu, không ai tuyển đâu”,... Trên thực tế, định kiến ấy đã dần cũ bởi theo khảo sát đến từ Robert Half International, Công ty tư vấn nguồn nhân lực toàn cầu gần đây thì có đến 71% nhà tuyển dụng hài lòng đối với những người nhảy việc.
Thùy Minh là host của rất nhiều chương trình truyền hình nổi tiếng cũng đã từng chia sẻ rằng chị hoàn toàn hiểu, thông cảm và dành cho nhân viên những quãng nghỉ khi nhân viên bày tỏ rằng: “Chị cho em xin nghỉ vài ngày. Sức khỏe tinh thần của em đang không ổn”.
Gen Z và lý do nghỉ việc liên quan đến sức khỏe tinh thần.
Lý do nghỉ việc của các thế hệ nhân sự trước đây thường liên quan đến sức khỏe thể chất, chuyện riêng trong gia đình,... nhưng gen Z xuất hiện và bổ sung vào danh sách đó là họ cần thời gian để chăm sóc sức khỏe tinh thần.
CEO Findjobs Đỗ Lan Anh chia sẻ trong một bài viết, cách để làm việc cùng gen Z chính là lắng nghe, thấu hiểu và trao quyền tự quyết cho họ. Nhìn vào thực tế, một bộ phận giới trẻ được sinh ra và lớn lên trong môi trường no đủ. Câu nói “ăn no, mặc ấm” dần được thay bằng “ăn ngon, mặc đẹp”. Điều mà gen Z hơn các thế hệ trước chính là sự lựa chọn. Mặc dù vậy thì trên vai họ cũng gánh theo vô vàn những áp lực vô hình mà các thế hệ trước cần nhiều thời gian và sự cởi mở để thấu hiểu.
Giờ đây đi làm với gen Z không còn là để đáp ứng nhu cầu về mặt kinh tế mà còn là một thành tố quan trọng tác động đến lối sống và định hướng phát triển trong tương lai. Cởi mở hơn khi nghe thấy, nhìn thấy người bên cạnh nhảy việc vì sức khỏe tinh thần của họ không ổn là điều cần được lan tỏa rộng rãi.
Sự thay đổi từ các công ty trên hành trình tạo ra môi trường làm việc lý tưởng
Rất nhiều những lãnh đạo doanh nghiệp, những người chủ công ty đã nhận ra vấn đề của nhân sự gen Z và có những thay đổi tích cực nhằm tạo ra một môi trường làm việc lý tưởng.
Minh chứng rõ nét cho khía cạnh này chính là việc Tiki lựa chọn Dreamplex là địa điểm để mở rộng chi nhánh làm việc tại Hà Nội. Chị Sakshi Jawa, Tổng Giám đốc nhân sự Tiki, doanh nghiệp hai lần được vinh danh có “Môi trường làm việc tốt nhất châu Á” đã bày tỏ về chỗ làm việc lý tưởng cho nhân viên chính là “Nơi nhân viên cảm thấy hạnh phúc bởi họ được quan tâm một cách toàn diện”.
Tiki hợp tác cùng Dreamplex để tạo nên một môi trường làm việc lý tưởng hơn (Nguồn ảnh: Dreamplex)
Sẽ thật tuyệt vời khi được làm việc ở một văn phòng được thiết kế với đầy đủ công năng và điều này sẽ giúp mọi người cảm nhận được nguồn năng lượng tích cực mỗi khi đi làm. Tiki đã và đang trên hành trình xây dựng điều đó bởi sự thay đổi của các nhân sự gen Z cũng như mong muốn tạo ra một môi trường làm việc tốt nhất.
Nhu cầu bên ngoài được đáp ứng là chưa đủ, thế hệ nhân sự gen Z còn mưu cầu về việc được thấu hiểu và lắng nghe những suy nghĩ, cá tính riêng của mỗi người. Một tinh thần khỏe sẽ là bước đà cho một sức khỏe tốt, đó cũng là yếu tố cần thiết để nâng cao hiệu suất công việc.
Trang Tara ở Co founder CIVIX Group chia sẻ: “Là một người sếp gen Z, mình thấu hiểu trọn vẹn hơn những khó khăn của nhân viên trên phương diện tinh thần. Đây cũng là lý do đằng sau những buổi nói chuyện, chia sẻ hàng tháng sau khi tổng kết công việc. Hành trình tìm hiểu nhân viên là một phần của kế hoạch tạo nên một doanh nghiệp lành mạnh và phát triển bền vững.”
Trang Tara, Co founder CIVIX Group đã có những chia sẻ gần gũi trong vai trò một người sếp gen Z.
Chuyện nhảy việc và sức khỏe tinh thần là hai khái niệm dường như khác biệt và không có điểm chung khi soi chiếu dưới hoàn cảnh của gen Z hay bất cứ nhân sự nào cũng có mặt liên quan nhất định. Cởi mở hơn, thấu hiểu hơn và nỗ lực vì một môi trường làm việc lý tưởng sẽ giúp thế hệ nhân sự gen Z cảm thấy hạnh phúc thật sự trên hành trình phát triển bản thân."
https://www.vtr.org.vn/zoposQKJgAh.aspx,Server Error in '/' Application.,,2023-06-11 00:00:00+07:00,
https://kenh14.vn/sinh-vien-lua-chon-hoc-song-nganh-de-duoc-theo-duoi-dam-me-vfx-3d-games-20230605160816523.chn,"
                                    Sinh viên lựa chọn học song ngành để được theo đuổi đam mê VFX-3D-GAMES",2023-06-06,2023-06-11 00:00:00-06:00,"Tải app
Sinh viên lựa chọn học song ngành để được theo đuổi đam mê VFX-3D-GAMES
Quang Vũ, Theo Trí Thức Trẻ 08:00 06/06/2023
Đi theo hai từ ""ổn định"" để học tập một ngành nghề phổ biến tại các trường Đại học/Cao đẳng, song song đó nhiều bạn trẻ vẫn lựa chọn Học viện Kỹ xảo Điện ảnh & Hoạt hình MAAC để được sống với đam mê nghệ thuật của mình.
Học song ngành hiện nay đang trở thành trào lưu của thế hệ trẻ. Trong thời đại công nghệ phát triển, nhiều bạn trẻ lựa chọn học song ngành để nâng cao kỹ năng của bản thân và mở rộng cơ hội phát triển sự nghiệp.
Nhiều trường hợp, các bạn lựa chọn học song ngành để tạo ra cầu nối giữa các lĩnh vực khác nhau, áp dụng kiến thức của cả hai vào mục tiêu nghề nghiệp của mình. Bên cạnh đó, nhiều bạn học song ngành vì khi trải qua ngành nghề đầu tiên, bạn mới nhận ra được đâu là đam mê thật sự của mình và can đảm theo đuổi.
Đó chính là câu chuyện của các bạn trẻ đang học song ngành tại Học viện MAAC, gồm: bạn Nguyễn Trọng Hiếu - Học viên ngành 3D Animation/sinh viên ngành Thiết kế đồ họa tại Đại học FPT, bạn Trần Thục Văn - Học viên ngành Thiết kế game/ sinh viên ngành Thiết kế đồ họa và bạn Kiều Duyên - Học viên ngành Thiết kế Game/ sinh viên ngành Kỹ thuật Hóa học tại Đại học Bách Khoa.
Hãy cùng Học viện MAAC lắng nghe những chia sẻ đầy thú vị của các học viên về câu chuyện học song ngành nhé!
Xin chào, đầu tiên hãy cho mọi người cùng biết hành trình của bạn đến với ngành VFX/3D/GAMES bắt đầu từ đâu nhé?
Kiều Duyên: Xưa nay mình đã thích về thiết kế, nên khi học xong cấp 3 mình đã quyết định đi theo sở thích của mình là Graphic Design và song song đó là học một ngành Kỹ thuật ở trường đại học khác theo định hướng của gia đình, mình đã chọn ngành Hóa tại Bách Khoa. Sau thời gian đầu học song ngành, cảm thấy việc học ở Bách Khoa khá nặng nên mình quyết định ngừng học Graphic Design ngay khi kết thúc học kỳ 1.
Lại một thời gian sau, khi dần cảm thấy mình và Bách Khoa ""không có liên quan gì với nhau lắm"" nên đã có suy nghĩ sẽ quay trở lại nhóm ngành nghệ thuật mà mình yêu thích. Và thật may khi thời điểm này ngành Game trở nên bùng nổ. Do đó mình quyết định tìm đến MAAC để theo đuổi ngành Thiết kế Game.
Trọng Hiếu: Trong quá trình học Thiết kế đồ họa tại FPT, mình có cơ hội được tiếp xúc với cả mảng 2D lẫn 3D. Qua một thời gian dài học tập, mày mò các phần mềm để giải đáp bài tập, đồ án, mình cảm thấy đam mê và phù hợp hơn ở mảng 3D so với 2D.
Sau khi nhận ra sở thích thật sự, mình đã đã bắt đầu nghiên cứu nhiều hơn và quyết định bước chân vào MAAC để bắt đầu học 3D chuyên sâu.
Thục Văn: Mình tìm ra MAAC như là một kỳ tích vậy. Tương tự như khi mình tìm ra được kho báu một cách bất ngờ, không lường trước được (cười).
Mình vốn đã yêu thích việc thiết kế nhân vật Game từ trước, nhưng vẫn chưa tìm thấy môi trường phù hợp. Sau một lần vô tình tìm thấy MAAC trên facebook, sau đó ấn vào và được tư vấn nhiệt tình, và… một cách nhanh chóng mình có mặt ở MAAC để theo đuổi đam mê Game Art & Design.
Lý do vì sao các bạn lại lựa chọn việc học song song hai ngành học?
Kiều Duyên: Chắc vì định hướng của gia đình. Thật ra gia đình vẫn mong muốn mình hoàn thành một ngành học ở trường đại học nào đó, để khi ra trường có được tấm bằng ổn định, họ sẽ an tâm hơn.
Nên khi quyết định theo đuổi đam mê với ngành làm Game, mình vẫn tiếp tục học ở Bách Khoa để hoàn thành cho xong chương trình học, sau đó sẽ tập trung phát triển nghề nghiệp từ đam mê.
Cả hai ngành các bạn đang theo học có bổ trợ gì cho nhau không?
Trọng Hiếu: Nếu như mình giỏi các kiến thức 2D, mình cũng sẽ dễ dàng áp dụng những kiến thức đó để phân tích và giải quyết một số vấn đề bên phần 3D. Mình cảm thấy việc học song song 2 ngành tương tự nhau giúp mình phát triển được rất nhiều thứ, nổi bật là khả năng mỹ thuật và tư duy thiết kế.
Bạn đã gặp phải những thách thức gì khi học song ngành? Nếu có, bạn đã vượt qua nó như thế nào?
Thục Văn: Thách thức của việc học song ngành chắc có lẽ là về thời gian và khối lượng kiến thức. Thời gian đầu khi gặp tình trạng này mình có hơi khó khăn, nhưng quen dần thì mình cũng biết cách sắp xếp để làm trước 1 trong 2 bên để đến deadline thì hoàn thành nốt bên còn lại. Ở MAAC cũng có một số thầy cô dễ, cho thư thả deadline nên mình cũng thấy thoải mái hơn.
Nhiều người hỏi mình như vậy có áp lực không, mình trả lời không. Bởi mình thấy bất kỳ ngành nghề nào đi nữa, đặc biệt là ngành nghệ thuật thì bị deadline ""dí"" là chuyện bình thường, cứ ""chill"" với nó thôi.
Vậy bên cạnh những thách thức, lợi thế của việc học song ngành là gì? Bạn đã tận dụng lợi thế đó như thế nào trong việc học?
Trọng Hiếu: Rõ ràng, việc học song ngành cho phép mình được tiếp cận với nhiều kiến thức hơn. Mình biết về mảng 3D nên có thể áp dụng kiến thức 3D đó vào những tác phẩm 2D và ngược lại. Điều này sẽ giúp cho cả 2 ngành đều được phát triển từng ngày, sản phẩm làm ra cũng tốt hơn chứ không mảng nào yếu hơn mảng nào. Đây là lợi thế của mình khi học song song 2 ngành 2D và 3D.
So với các bạn đồng trang lứa, bạn có cảm thấy việc học song ngành mang lại cho bản thân lợi thế gì hơn không? Cụ thể đó là gì?
Kiều Duyên: Mình nghĩ rằng việc học song ngành cung cấp cho mình lượng kiến thức nhiều hơn, mình hiểu được nhiều kiến thức chuyên sâu hơn so với các bạn học.
Tiếp xúc với mấy bạn học cùng lớp và có chơi với bạn ngoài lớp, có nhiều thứ mình biết nhiều hơn mấy bạn, nhưng không phải do mình tìm hiểu nhiều mà là do những kiến thức từ môi trường đại học mang lại.
Trọng Hiếu: Nếu như các bạn đã quyết định học song ngành, thì hãy xác định rõ đâu mới chính là ngành mà bạn muốn phát triển trong tương lai, từ đó mà phân chia thời gian học tập phù hợp.
Kiều Duyên: Việc học song ngành khá khó để mình có thể đảm nhiệm tốt được cả hai, dễ áp lực. Mình nghĩ rằng nếu các bạn quyết định học song ngành, vừa học ở trường đại học để gia đình an tâm và vừa theo đuổi đam mê với các ngành nghệ thuật khác, bạn hãy cố gắng thoải mái, đừng áp lực mình học tốt tất cả mọi thứ, chỉ cần vừa đủ là được. Dần dần thì mọi thứ cũng sẽ ổn. Hãy cố gắng lên nhé!
Lời kết
Qua những chia sẻ đầy bổ ích từ Học viên MAAC, chắc chắn rằng các bạn trẻ sẽ có thêm nhiều góc nhìn bổ ích về câu chuyện học song ngành. Hy vọng rằng nhờ vào đó, các bạn có thể mạnh dạn hơn để theo đuổi đam mê của chính bản thân mình.
Học viện Kỹ xảo Điện ảnh & Hoạt hình MAAC tuyển sinh 2023
Ngành tuyển sinh:
- Kỹ xảo điện ảnh (Visual Effects - VFX)
- Hoạt hình 3D (3D Animation)
- Thiết kế Game (Game Art & Design)
Đối tượng tuyển sinh: Học sinh tốt nghiệp THPT, sinh viên, người đi làm muốn nâng cao năng lực chuyên môn hoặc chuyển ngành.
Điều kiện tuyển sinh: Thí sinh vượt qua bài test năng lực sáng tạo Cinegraphy do học viện MAAC tổ chức."
