link,title,time,time_parsed,text
https://top10tphcm.com/truong-dao-tao-nganh-kinh-te-tot-nhat-o-ha-noi,Top 10 trường Đại học đào tạo ngành Kinh tế ở Hà Nội tốt nhất,2023-06-07,2023-06-11 00:00:00-06:00,"Top 10 trường Đại học đào tạo ngành Kinh tế ở Hà Nội tốt nhất
Ngành kinh tế đang là một trong những ngành được nhiều bạn học sinh lựa chọn. Tuy nhiên, việc tìm ra một trường đại học có ngành kinh tế ở Hà Nội uy tín có thể là một việc khó khăn đối với các bạn học sinh chuẩn bị bước vào cánh cổng đại học. Dưới đây là danh sách Top 10 trường Đại học đào tạo ngành Kinh tế ở Hà Nội tốt nhất sau 6 tháng chúng tôi đã tìm hiểu và nghiên cứu, thì chắc chắn rằng bài viết này sẽ không làm bạn phải thất vọng đâu.
Danh sách các trường dạy ngành Kinh tế ở Hà Nội chất lượng
1
Trường Đại Học Kinh Tế Quốc Dân (NEU)
Các trường đại học có ngành kinh tế ở Hà Nội đóng vai trò quan trọng trong việc đào tạo và phát triển nguồn nhân lực chất lượng cao cho lĩnh vực quản lý và kinh tế. Trong số đó, Trường Đại học Kinh tế Quốc dân (NEU) là một trong những ngôi những trường đào tạo kinh tế nổi tiếng ở Hà Nội. NEU được biết đến như là trường đại học hàng đầu Việt Nam với việc đào tạo các khối ngành quản lý và kinh tế ở miền Bắc. Trường chuyên tập trung vào việc đào tạo các cử nhân kinh tế từ trình độ đại học đến sau đại học. Ngoài ra, NEU còn là trung tâm nghiên cứu kinh tế chuyên sâu, tư vấn các chính sách vĩ mô cho nhà nước và chuyển giao công nghệ quản trị và quản lý.
Đến năm 2020, NEU đã trở thành một trường đại học hiện đại với đầy đủ trang thiết bị hiện đại. Trường đang tiến hành nâng cấp hệ thống phòng học, soạn và xuất bản giáo trình và các tài liệu tham khảo, trang bị các thiết bị hiện đại, hệ thống thông tin phục vụ công tác đào tạo và nghiên cứu, cũng như đổi mới và nâng cấp cơ sở vật chất với những trang thiết bị hiện đại. Điều này đảm bảo rằng chất lượng giảng dạy và học tập tại NEU đáp ứng chuẩn quốc tế.
Trường Đại học Kinh tế Quốc dân không ngừng nỗ lực để trở thành trường đại học đa ngành, trường đại học định hướng nghiên cứu, và đạt chất lượng đẳng cấp khu vực và quốc tế trong lĩnh vực quản trị kinh doanh, quản lý kinh tế và nhiều lĩnh vực mũi nhọn khác. Điều này làm cho NEU trở thành một lựa chọn hàng đầu cho những ai muốn tìm kiếm các trường Đại học kinh tế ở Hà Nội.
NEU có nhóm ngành thế mạnh gồm Kinh doanh quốc tế, Kinh tế quốc tế, Kinh doanh thương mại, Marketing, và nhiều ngành khác. Điểm chuẩn để nhập học vào NEU dao động từ 26,10 đến 28,60, và mức học phí tham khảo của trường cũng phù hợp với đa số sinh viên, với chương trình đại trà từ 16-22 triệu đồng/năm và chương trình đặc thù từ 45-65 triệu đồng/năm.
Khu vực gairng đường của trường Đại học Kinh tế Quốc dân | Nguồn: Trường Đại học Kinh tế Quốc dân (NEU)
Với những tiến bộ và cam kết không ngừng phấn đấu, NEU đang hướng đến mục tiêu trở thành một trong số 1000 trường đại học hàng đầu thế giới. Vì vậy, nếu bạn đang quan tâm đến các trường đại học kinh tế ở Hà Nội, NEU là sự lựa chọn hàng đầu và xứng đáng để các bạn cân nhắc.
Trường Đại Học Mở Hà Nội
Khi bạn đang đặt câu hỏi “trường nào dạy ngành kinh tế tốt nhất ở Hà Nội?” thì một trong những trường mà chúng tôi muốn giới thiệu đến bạn đó chính là Trường Đại học Mở Hà Nội. Với sứ mệnh là cơ sở giáo dục đại học mở đa lĩnh vực và đa ngành, TrườngĐại học Mở Hà Nội được trao quyền tự chủ, tự chịu trách nhiệm trong hệ thống giáo dục Việt Nam tại Hà Nội.
Với quy mô đào tạo hàng năm lên đến khoảng 60.000 sinh viên trong các hệ chính quy, tại chức và đào tạo từ xa, cùng với 11 khoa đào tạo chuyên ngành, Trường Đại học Mở Hà Nội đáp ứng nhu cầu học tập đa dạng và đem lại chất lượng đào tạo tốt. Trường có đội ngũ giảng viên đầy đủ với 322 Tiến sĩ khoa học và Tiến sĩ, 29 Giáo sư, 123 Phó Giáo sư, và 487 Thạc sĩ, tạo ra môi trường học tập chuyên nghiệp và giàu kiến thức.
Một góc chụp của Trường Đại học mở Hà Nội | Nguồn: Trường Đại học mở Hà Nội
Ngoài việc được đánh giá là một trong các trường đại học kinh tế hàng đầu ở Việt Nam và đặc biệt ở Hà Nội, Trường Đại học Mở Hà Nội còn mang đến cơ hội học tập đa dạng và linh hoạt cho học viên. Trường chú trọng đào tạo từ xa với đa trình độ và đa ngành, nhằm phục vụ cho sự nghiệp xây dựng đất nước và hội nhập quốc tế. Với tầm nhìn phấn đấu trở thành cơ sở giáo dục đại học đa lĩnh vực, đa ngành, đa trình độ và đa phương thức, Trường Đại học Mở Hà Nội xác định mục tiêu nâng cao chất lượng chương trình nghiên cứu khoa học và chương trình đào tạo, nhằm tạo dựng vị trí vững chắc trong hệ thống các trường đại học mở tại Châu Á.
Với những đặc điểm và cam kết này, Trường Đại học Mở Hà Nội là một lựa chọn đáng cân nhắc cho những ai quan tâm đến ngành kinh tế và mong muốn nhận được một hình thức giáo dục đại học uy tín và đa phương thức.
Trường Đại Học Thương Mại
Các trường có ngành kinh tế ở Hà Nội đều đóng góp đáng kể vào việc đào tạo và phát triển nguồn nhân lực chất lượng cao trong lĩnh vực kinh tế. Trong số đó, Trường Đại học Thương Mại nổi bật với vị trí đặt tại số 79 đường Hồ Tùng Mậu, phường Mai Dịch, quận Cầu Giấy, TP. Hà Nội và khuôn viên trường rộng lớn với diện tích 84.000 m2, là một trong những cơ sở có cảnh quan và khuôn viên đẹp nhất trong các trường kinh tế tại thủ đô.
Trường Đại học Thương Mại đã có hơn một thập kỷ đào tạo và cung cấp hàng nghìn thạc sĩ, tiến sĩ kinh tế cùng hàng chục nghìn cử nhân kinh tế cho xã hội. Đồng thời, trường còn bồi dưỡng một lượng lớn cán bộ quản lý kinh tế cho ngành thương mại và các ngành khác. TMU cũng đóng góp đáng kể vào lĩnh vực nghiên cứu khoa học, tham gia thực hiện nhiều đề tài nghiên cứu cấp nhà nước và hợp tác với doanh nghiệp, cơ quan được Nhà nước và cộng đồng doanh nghiệp đánh giá cao.
Khuôn viên trường Đại học Thương Mại| Nguồn: Trường Đại học Thương Mại
Với bề dày lịch sử và chất lượng cao đa lĩnh vực và đa ngành, trường Đại học Thương Mại là một trong những trường đại học hàng đầu và được xếp trong top 5 trường đại học tốt nhất Việt Nam trong lĩnh vực kinh tế, quản lý và kinh doanh. Trường không chỉ tự hào với đội ngũ cán bộ viên chức trên 600 người, mà còn ấn tượng với sự đa dạng và quốc tế của đội ngũ giảng viên, nhiều trong số họ đã và đang có kinh nghiệm học tập và nghiên cứu tại các nước và vùng lãnh thổ hàng đầu trên thế giới.
Trường Đại học Thương Mại cũng nổi bật với sứ mệnh xã hội của mình, đặc biệt trong việc đảm bảo cơ hội tiếp cận giáo dục cho các đối tượng thuộc hộ nghèo và đối tượng chính sách. Đây là một trường đào tạo chất lượng trong lĩnh vực kinh tế không chỉ ở Việt Nam nói chung, mà còn ở Hà Nội nói riêng. Với các chương trình đào tạo đa dạng và sự cam kết vững chắc với trách nhiệm xã hội, Trường Đại học Thương Mại là một sự lựa chọn mạnh mẽ cho những ai quan tâm đến ngành kinh tế và muốn có một tương lai nghề nghiệp thịnh vượng. Nếu bạn vẫn đang tìm một trường có xét học bạ ngành Kinh tế tại Hà Nội thì Trường Đại học Thương Mại là một trường mà bạn nên ghi chú lại ngay.
Thư viện trường Đại học Thương Mại | Nguồn: Trường Đại học Thương Mại
Trường Đại học Mở Hà Nội là một trường đại học nổi tiếng tại Hà Nội. Mức điểm chuẩn của trường theo phương thức xét kết quả thi tốt nghiệp THPT thường dao động từ 16,5 đến 26,75 điểm. Điểm chuẩn có thể thay đổi mỗi năm dựa trên số lượng thí sinh đăng ký và điểm sàn của trường.
Trường Đại Học Ngoại Thương
Nếu bạn quan tâm và đang tự hỏi ngành kinh tế thì học trường nào ở Hà Nội? thì trường Đại học Ngoại Thương là một lựa chọn không thể bỏ qua. Được thành lập từ năm 1960, trường này đã khẳng định vị thế của mình là một trong những trường đại học hàng đầu trong lĩnh vực kinh tế không chỉ ở Việt Nam mà còn trên toàn quốc.
Đại học Ngoại Thương nổi tiếng với việc đào tạo các ngành kinh tế top đầu cả nước. Nếu bạn muốn theo học ngành kinh tế quốc tế, kinh tế đối ngoại, hay thương mại quốc tế, trường sẽ là sự lựa chọn hàng đầu. Với chất lượng đào tạo hiện đại, trường đã được nhiều trường đại học quốc tế công nhận và xây dựng quan hệ đào tạo. Điều này tạo điều kiện tốt cho sinh viên trường Ngoại Thương có cơ hội trau dồi kiến thức và kỹ năng với sự hỗ trợ từ các đối tác quốc tế. Đại học La Trobe và Đại học Queensland ở Úc, Đại học Vân Truyền ở Đài Loan, Đại học Tổng hợp Colorado (CSU) ở Hoa Kỳ, Đại học Asia Pacific ở Nhật Bản, Đại học Rennes ở Pháp, và Đại học Bedfordshire ở Anh là một số trong số những đối tác đào tạo quốc tế của trường.
Khuôn viên trường Đại học Ngoại Thương| Nguồn: Trường Đại học Ngoại Thương
Sinh viên của trường Đại học Ngoại Thương không chỉ thành công trong lĩnh vực kinh tế, mà còn được khẳng định tài năng của mình ở nhiều lĩnh vực khác như âm nhạc, truyền thông, truyền hình, hoặc nghệ thuật. Điều này chứng tỏ trường không chỉ tạo ra những chuyên gia kinh tế xuất sắc, mà còn tạo điều kiện để sinh viên phát triển đa mặt và tận dụng tài năng sáng tạo của mình.
Trường Đại học Ngoại thương (Foreign Trade University) đã công bố điểm chuẩn năm 2022 cho các ngành học. Trong đó, nhóm ngành Kinh tế và Luật Kinh tế đạt mức điểm chuẩn cao nhất, là 28,40 điểm. Vì vậy, nếu bạn đam mê ngành kinh tế và muốn một tương lai nghề nghiệp đầy triển vọng, Đại học Ngoại Thương là một sự lựa chọn vô cùng hấp dẫn. Với danh tiếng, chất lượng đào tạo và mạng lưới đối tác quốc tế, trường sẽ mang lại cho bạn những kiến thức, kỹ năng và cơ hội để phát triển trong ngành kinh tế và nhiều lĩnh vực khác, đồng thời khẳng định được tầm quốc tế của bản thân.
Lễ tuyên dương của trường Đại học Ngoại Thương | Nguồn: Trường Đại học Ngoại Thương
Trường Đại Học FPT
Trường Đại học FPT được biết đến là một trường Đại học đào tạo ngành kinh tế chất lượng ở Hà Nội. Với sứ mệnh đào tạo kỹ sư và cử nhân đại học, Trường Đại học FPT đã được thành lập vào năm 2006 nhằm tiến một bước mở rộng mạnh mẽ trong việc phát triển hệ sinh thái giáo dục tại Việt Nam. Từ đó đến nay, trường không ngừng phát triển và hiện đã có 12 ngành học thuộc hệ đào tạo chính quy, mở ra nhiều cơ hội học tập và nghiên cứu cho sinh viên. Trường Đại học FPT nổi bật như một cơ sở đào tạo tư nhân và là thành viên quan trọng của Tổ chức Giáo dục FPT Education thuộc tập đoàn FPT.
Các ngành học đa dạng tại Trường Đại học FPT bao gồm Khoa học máy tính, Quản trị Kinh doanh, Kỹ thuật phần mềm, An toàn thông tin, Tài chính ngân hàng, Kinh doanh quốc tế, Quản trị khách sạn, Ngôn ngữ (Anh, Nhật, Hàn, Trung Quốc), Truyền thông đa phương tiện và Thiết kế đồ họa. Những ngành học này phù hợp với xu hướng và nhu cầu phát triển của thị trường lao động đương đại.
Góc chụp từ trên cao của trường Đại học FPT| Nguồn: Trường Đại học FPT
Tại các trường đại học về kinh tế ở Hà Nội, Trường Đại học FPT nổi lên như một điểm đáng chú ý với chất lượng giáo dục và sự đa dạng ngành học. Trường tập trung vào việc trang bị cho sinh viên những kiến thức và kỹ năng chuyên môn cần thiết để thành công trong lĩnh vực kinh tế đang thay đổi nhanh chóng. Đồng thời, việc có sự hỗ trợ từ giảng viên giàu kinh nghiệm và mạng lưới quốc tế liên kết mang lại cho sinh viên một môi trường học tập và nghiên cứu đa chiều.
Xét theo phương thức điểm học tập THPT (Học bạ), đối với các thí sinh tốt nghiệp THPT trước năm 2020, tổng điểm của 3 môn phải đạt:
21 điểm trở lên (với thí sinh tại Hà Nội và TP.HCM)
19.5 điểm trở lên (với thí sinh tại Đà Nẵng và Cần Thơ)
Với tập trung vào chất lượng giáo dục, đa dạng ngành học và sự hỗ trợ từ mạng lưới quốc tế, trường Đại học FPT, mang đến cho sinh viên những cơ hội phát triển không chỉ trong lĩnh vực kinh tế và kinh doanh, mà còn trong toàn bộ sự nghiệp của họ. Đối với kì tuyển sinh năm 2022 trường Đại học FPT lấy điểm chuẩn là 15 điểm cho tất cả các ngành. Nếu bạn vẫn đang tìm kiếm trường Đại học đào tạo có xét học bạ ngành kinh tế tại Hà Nội thì Trường Đại học FPT là một ngôi trường mà chúng tôi muốn gợi ý đến bạn.
Trường Đại Học Thăng Long
Khi nghiên cứu về ngành kinh tế ở Hà Nội, câu hỏi “Ngành kinh tế nên học trường nào ở Hà Nội?” là một thách thức đối với các bạn học sinh chuẩn bị bước vào trường đại học. Trên thực tế, có nhiều trường đại học với chất lượng đào tạo tốt. Một trong số đó là Đại học Thăng Long, được biết đến là ngôi trường đại học hiện đại hàng đầu tại Việt Nam.
Với hơn 30 năm xây dựng và phát triển, Đại học Thăng Long đã khẳng định tên tuổi và chất lượng đào tạo. Mỗi năm, trường đào tạo hơn 2000 sinh viên tốt nghiệp, đáp ứng nhu cầu về nhân lực chất lượng cao cho quá trình công nghiệp hóa và hiện đại hóa đất nước. Với mục tiêu không vì lợi nhuận, trường cam kết tiếp tục phát triển bền vững và đóng góp tích cực vào xây dựng một xã hội học tập công bằng cho mọi công dân.
Thư viện của Trường Đại học Thăng Long | Nguồn: Trường Đại học Thăng Long
Ngoài Đại học Thăng Long, còn có nhiều trường đại học khác ở Hà Nội đáng xem xét. Ví dụ như Đại học Kinh tế Quốc dân, Đại học Ngoại thương, Đại học Thương mại và Đại học Kinh tế và Quản lý. Mỗi trường đại học này có những điểm mạnh riêng, chương trình đào tạo đa dạng và đội ngũ giảng viên giàu kinh nghiệm. Do đó, việc lựa chọn trường đại học phù hợp vẫn phụ thuộc vào sở thích cá nhân, mục tiêu nghề nghiệp và mong muốn học tập của bạn. Đồng thời điểm chuẩn của các ngành cũng dao động từ 19,05-26,15 điểm.
Vậy, để đáp ứng câu hỏi “Ngành kinh tế nên học trường nào ở Hà Nội?”, bạn có thể xem xét những trường đại học trên và tìm hiểu kỹ về chương trình đào tạo, giảng viên, môi trường học tập và cơ hội nghề nghiệp mà mỗi trường mang lại. Qua đó, bạn sẽ có cái nhìn tổng quan và có thể đưa ra quyết định phù hợp với ước mơ và mục tiêu của bản thân.
Lớp học của các bạn sinh viên Trường Đại học Thăng Long| Nguồn: Trường Đại học Thăng Long
Trường Đại Học Tài Chính – Ngân Hàng Hà Nội
Các trường đại học đào tạo ngành kinh tế tốt nhất ở Hà Nội đang phát triển và đáp ứng nhu cầu ngày càng tăng về nguồn nhân lực chất lượng trong lĩnh vực tài chính ngân hàng và kinh tế quốc tế. Một trong số những trường đáng chú ý là Trường Đại học Tài chính Ngân hàng Hà Nội.
Trường Đại học Tài chính Ngân hàng Hà Nội được thành lập nhằm đáp ứng nhu cầu của xã hội trong bối cảnh Việt Nam đang hội nhập kinh tế quốc tế ngày càng mở rộng. Được thành lập theo Quyết định số 2336/2010/QĐ-TTg năm 2010 của Thủ tướng Chính phủ, trường đại học này là một trường đại học tư thục. Trường Đại học Tài chính Ngân hàng Hà Nội đã chính thức đi vào hoạt động với sứ mệnh đào tạo nguồn nhân lực tài chính-ngân hàng có chất lượng cao và đáp ứng theo hướng Chuyên ngành, Liên thông, Đa cấp, Hội nhập. Ngoài ra, trường cũng đặc biệt chú trọng vào nghiên cứu khoa học kinh tế-tài chính, nhằm góp phần vào sự phát triển của đất nước
Thư viện của trường Đại Học Tài Chính – Ngân Hàng Hà Nội | Nguồn: Trường Đại Học Tài Chính – Ngân Hàng Hà Nội
Khi học tại Trường Đại Học Tài Chính – Ngân Hàng Hà Nội người học không chỉ được trang bị những kiến thức cơ sở trong ngành đào tạo, mà còn được hướng dẫn để phát triển khả năng nghiên cứu và cập nhật công nghệ mới. Điều này giúp họ không ngừng tự học suốt đời trong môi trường công tác sau khi tốt nghiệp. Đồng thời, họ cũng được rèn luyện kỹ năng thực hành chuyên sâu và chuyên nghiệp trong chuyên ngành mà mình được đào tạo.
Học Viện Ngân hàng
Các trường đại học kinh tế chất lượng ở Hà Nội đóng vai trò quan trọng trong việc đào tạo nhân lực có trình độ cao và đáp ứng nhu cầu ngành tài chính-ngân hàng trong bối cảnh hội nhập và toàn cầu hóa ngày càng phát triển. Trong số đó, Học viện Ngân hàng nổi bật như một ngôi trường hàng đầu, vượt trội trong lĩnh vực tài chính-ngân hàng tại Việt Nam.
Học viện Ngân hàng không chỉ có lịch sử lâu đời mà còn sở hữu đội ngũ giảng viên tận tâm và giàu kinh nghiệm. Trường luôn tạo môi trường thuận lợi để sinh viên và giáo viên gắn kết với nhau, từ đó xây dựng mối quan hệ giữa thầy và trò trở nên gần gũi và thân thiết. Sinh viên tại trường được công nhận cao về tính cẩn thận, sự tỉ mỉ, sự năng động và trách nhiệm trong công việc. Đây thực sự là một trong những trường đại học kinh tế hàng đầu ở Hà Nội và trên cả nước.
Góc chụp từ trên cao của Học viện Ngân hàng | Nguồn: Học viện Ngân hàng
Với tầm nhìn hội nhập và toàn cầu hóa, Học viện Ngân hàng không chỉ tập trung vào các chuyên ngành đào tạo truyền thống mà còn đẩy mạnh phát triển các chuyên ngành mới để đáp ứng nhu cầu nhân lực có trình độ cao cho ngành ngân hàng, tài chính và xã hội. Một trong những chuyên ngành mới đó là Khoa Hệ thống thông tin quản lý, nơi mà sinh viên được đào tạo và nghiên cứu trong lĩnh vực Hệ thống thông tin kinh tế. Sau khi tốt nghiệp, sinh viên chuyên ngành này được trang bị kiến thức vững chắc về ứng dụng công nghệ thông tin và hệ thống thông tin quản lý trong hoạt động của tổ chức tài chính, ngân hàng và các doanh nghiệp khác.
Sinh viên tốt nghiệp từ Học viện Ngân hàng sẽ có khả năng phân tích, thiết kế, tổ chức phát triển và quản lý các hệ thống thông tin trong thực tế. Đặc biệt, họ cũng có khả năng tham gia vào quyết định chính sách và chỉ đạo việc ứng dụng công nghệ thông tin tại các tổ chức ngân hàng, tài chính cũng như doanh nghiệp nói chung. Những kỹ năng này làm nổi bật và tạo điểm mạnh cho sinh viên sau khi ra trường, mở ra nhiều cơ hội nghề nghiệp và đóng góp tích cực vào sự phát triển của ngành kinh tế và xã hội.
Buổi talk Show Gen z khởi nghiệp trong kỷ nguyên số được tổ chức tại Học viện Ngân hàng| Nguồn: Học viện Ngân hàng
Học viện Ngân hàng đã chính thức công bố điểm chuẩn cho năm 2022. Theo phương thức xét kết quả thi tốt nghiệp THPT, mức điểm chuẩn dao động từ 24 đến 28,05. Theo thông báo từ Học viện Ngân hàng vào chiều ngày 15/9, ngành Luật kinh tế có điểm chuẩn cao nhất là 28,05, cao hơn 0,5 điểm so với năm trước; tiếp theo là ngành Kinh doanh quốc tế với mức điểm 26,5.
Trường Đại Học Công Đoàn
Hà Nội là nơi tập trung nhiều trường kinh tế uy tín, đáng được nhắc đến trong số đó là Đại học Công đoàn. Ngoài việc đạt được sự đánh giá cao về chất lượng đào tạo, trường Đại học Công đoàn Hà Nội còn được xem là một trong các trường dạy ngành Kinh tế uy tín ở Hà Nội. Sự phát triển và uy tín của trường đã thu hút sự quan tâm của sinh viên và xã hội, và trường luôn nỗ lực không ngừng để duy trì và nâng cao vị thế này. Các chương trình đào tạo tại trường Đại học Công đoàn Hà Nội được thiết kế cẩn thận và phù hợp với nhu cầu ngành kinh tế hiện đại, từ đó đảm bảo rằng sinh viên được trang bị kiến thức sâu rộng và kỹ năng chuyên môn thực tế để sẵn sàng hành nghề và phát triển sự nghiệp trong lĩnh vực kinh tế.
Trường không chỉ nằm trong danh sách các trường đại học công lập lâu đời nhất Việt Nam, mà còn tự hào là một ngôi trường đào tạo chuyên nghiệp và đạt chất lượng cao. Với tầm nhìn tập trung vào người học, trường luôn đặt mục tiêu nâng cao chất lượng giảng dạy và đổi mới chương trình đào tạo để đáp ứng tiêu chuẩn quốc tế.
Phía trước cổng trường Đại Học Công Đoàn | Nguồn: Trường Đại Học Công Đoàn
Khoa Kinh tế của Trường Đại học Công đoàn Hà Nội có một vị trí đặc biệt và đóng góp quan trọng trong lịch sử của trường. Với sự ra đời sớm nhất từ khi Trường Công đoàn Trung ương (nay là Trường Đại học Công đoàn) được thành lập, Khoa Kinh tế đã trở thành một phần không thể thiếu và là ngôi nhà thân thiết của nhiều thế hệ cán bộ giảng viên. Hiện nay, Khoa Kinh tế có một đội ngũ giảng viên gồm 11 thành viên, trong đó có 1 giảng viên đã đạt trình độ tiến sĩ và 10 giảng viên sở hữu trình độ thạc sĩ. Ngoài ra, trong số này, có 3 giảng viên đang theo học cao học. Về tổ chức, khoa được chia thành hai nhóm chuyên môn chính, bao gồm nhóm Kinh tế (giảng dạy các học phần Kinh tế vi mô, Kinh tế vĩ mô, Lập và quản lý dự án đầu tư) và nhóm Thống kê (giảng dạy các học phần Thống kê lao động, Thống kê kinh doanh).
Các học phần được giảng dạy tại Khoa Kinh tế đáp ứng nhu cầu đa dạng của sinh viên các khoa khối ngành Kinh tế và Quản trị kinh doanh, bao gồm Khoa Kế toán, Khoa Tài chính Ngân hàng, Khoa Quản trị kinh doanh, Khoa Quản trị nhân lực và Khoa Quan hệ lao động. Điều này đảm bảo rằng sinh viên được trang bị kiến thức sâu rộng và kỹ năng chuyên môn đa ngành, giúp họ sẵn sàng đáp ứng được nhu cầu của thị trường lao động đầy thách thức trong tương lai.
Trường Đại Học Kinh Tế – Kỹ Thuật Công Nghiệp
Tại Hà Nội sẽ có rất nhiều trường đào tạo ngành kinh tế, điều đó làm bạn phải phân vân vì không biết nên chọn trường nào? Chính vì đó mà chúng tôi cũng muốn đề xuất đến bạn một trường khá là uy tín tại Hà Nội đó là trường Đại học Kinh tế- kỹ thuật Công nghiệp. Trường Đại học Kinh tế – Kỹ thuật Công nghiệp được thành lập vào năm 2007, đánh dấu bước nâng cấp từ trường Cao đẳng Kinh tế Kỹ thuật Công nghiệp I. Với sứ mệnh đào tạo đa ngành, đa cấp, trường đã khẳng định mục tiêu của mình là đào tạo nguồn nhân lực chất lượng cao, luôn tiếp cận thực tiễn và đáp ứng nhu cầu phát triển của vùng đồng bằng sông Hồng và đất nước trong thời kỳ hội nhập kinh tế.
Trường Đại học Kinh tế – Kỹ thuật Công nghiệp được thành lập theo quyết định của Thủ tướng Chính phủ vào năm 2007. Trải qua hơn nửa thế kỷ phát triển, nhà trường đã vượt qua mọi thử thách để đạt được những thành công về đào tạo và phát triển nguồn nhân lực đất nước. Sự nỗ lực, sáng tạo và trí tuệ của tập thể lãnh đạo, cán bộ, giáo viên và sinh viên đã giúp trường phát triển bền vững và ghi dấu ấn trong lĩnh vực giáo dục.
Một góc chụp tại trường Đại Học Kinh Tế – Kỹ Thuật Công Nghiệp | Nguồn; Trường Đại Học Kinh Tế – Kỹ Thuật Công Nghiệp
Trong quá trình phát triển, Trường Đại học Kinh tế – Kỹ thuật Công nghiệp đã triển khai dự án “Quy hoạch tổng thể Trường Đại học Kinh tế – Kỹ thuật đến năm 2020” với vốn đầu tư lên đến 550 tỷ đồng. Nhà trường đã xây dựng cơ sở vật chất hiện đại, bao gồm nhà 15 tầng, xưởng thực hành và nhà ký túc xá tại cơ sở Mỹ Xá, cùng hệ thống cảnh quan và sân vườn cho cả hai cơ sở Hà Nội và Nam Định. Sự đầu tư này đã làm tăng đáng kể chất lượng và trải nghiệm học tập của sinh viên.
Với những thành tựu và tiềm năng phát triển, Trường Đại học Kinh tế – Kỹ thuật Công nghiệp là một trong những lựa chọn hàng đầu cho những ai muốn theo học ngành kinh tế tại Hà Nội. Trường cam kết mang đến một môi trường học tập chất lượng cao, đáp ứng các yêu cầu của thị trường lao động và giúp sinh viên phát triển sự nghiệp trong lĩnh vực kinh tế.
Khuôn viên trường Đại Học Kinh Tế – Kỹ Thuật Công Nghiệp | Nguồn: Trường Đại Học Kinh Tế – Kỹ Thuật Công Nghiệp
Bài viết trên đã tổng hợp những thông tin về Top 10 trường Đại học đào tạo ngành Kinh tế ở Hà Nội tốt nhất nhằm giúp bạn có thêm lựa chọn trong việc tìm kiếm trường phù hợp với mình. Nếu bạn còn bất kỳ thắc mắc nào về chuyên ngành này, hãy liên hệ ngay với trường mà bạn muốn để có thể nắm rõ thông tin hơn nhé!"
