link,title,time,time_parsed,text
https://onehousing.vn/blog/can-2pn-3pn-4pn-o-chung-cu-dreamland-bonanza-quan-cau-giay-co-dien-tich-the-nao-n17t,"Căn 2PN, 3PN, 4PN ở chung cư Dreamland Bonanza quận Cầu Giấy có diện tích thế nào?",2023-06-08,2023-06-11 00:00:00-06:00,"Bạn đang quan tâm về dự án chung cư Dreamland Bonanza quận Cầu Giấy. Theo dõi bài viết của OneHousing ngày hôm nay để biết thêm chi tiết về dự án cũng như các căn hộ từ 2 - 4PN tại đây.
Chung cư Dreamland Bonanza quận Cầu Giấy đang là dự án căn hộ được cư dân thủ đô quan tâm. Với mong muốn sở hữu không gian sống thoải mái cho gia đình, cùng xem các căn 2PN, 3PN, 4PN thuộc dự án này có diện tích là bao nhiêu nhé.
Giới thiệu về căn hộ chung cư Dreamland Bonanza quận Cầu Giấy
Với phương châm kiến tạo chất lượng cuộc sống mới, Dreamland Bonanza được đánh giá như một “vùng đất trong mơ”, một không gian sống lý tưởng giữa lòng thủ đô. Chung cư Dreamland Bonanza mang đến các sản phẩm căn hộ cao cấp, phù hợp với nhiều đối tượng đang tìm mua căn hộ tại Hà Nội.
Vị trí chung cư Dreamland Bonanza quận Cầu Giấy
Tòa nhà phức hợp Dreamland Bonanza sở hữu tọa độ vàng tại số 23 phố Duy Tân, thuộc phường Dịch Vọng Hậu, quận Cầu Giấy. Với quy mô 0,4ha, dự án được bao bọc bởi những tuyến đường trọng điểm của quận Cầu Giấy như Phạm Hùng, Tôn Thất Thuyết, đường vành đai 3,...
Tòa chung cư Dreamland Bonanza Cầu Giấy cao 32 tầng, sở hữu 3 tầng hầm đỗ xe. Tổng số căn hộ đưa ra thị trường là 370 căn, với mật độ 16 căn/tầng. Từ chung cư Dreamland Bonanza, cư dân dễ dàng tiếp cận với các tiện ích hành chính, văn hóa xã hội ở khu vực lân cận.
Cơ quan Bộ, ngành: Bộ Ngoại giao, Bộ Công an, Viện kiểm sát,...
Hệ thống giáo dục: Đại học FPT, Đại học Thương Mại, THCS Cầu Giấy, THCS Dịch Vọng Hậu,...
Hệ thống y tế, chăm sóc sức khỏe: Viện huyết học và truyền máu trung ương, Bệnh viện Y học cổ truyền,...
Hệ thống khu vui chơi giải trí, trung tâm thương mại: Công viên Cầu Giấy, Tòa nhà Indochina Plaza Hanoi, Tháp Keangnam Landmark,...
Liên kết vùng của chung cư Dreamland Bonanza quận Cầu Giấy (nguồn: Dreamland Bonanza)
Chủ đầu tư dự án Dreamland Bonanza Cầu Giấy
Dreamland Bonanza được phát triển bởi Công ty Đầu tư bất động sản Vinaland. Đi vào hoạt động từ cuối năm 2009, Vinaland đã có gần 14 năm hoạt động trong lĩnh vực tư vấn và hỗ trợ đầu tư bất động sản.
Dự án Dreamland Bonanza là dự án căn hộ chung cư đầu tiên và duy nhất của đơn vị Vinaland cho tới thời điểm hiện tại. Chính vì vậy, Vinaland đã dồn hết tâm sức, phối hợp cùng các đơn vị thiết kế nổi tiếng để xây dựng nên một khu chung cư cao cấp, kiến tạo nên không gian sống chất lượng cho cư dân.
Hệ thống tiện ích nội khu chung cư Dreamland Bonanza
Trở thành cư dân Dreamland Bonanza Cầu Giấy, bạn sẽ được trải nghiệm toàn bộ dịch vụ tiện ích mà chủ đầu tư xây dựng giành riêng cho Dream Land Bonanza. Những tiện ích đa dạng, hiện đại và đẳng cấp bậc nhất sẽ mang tới cuộc sống thông minh và tiện lợi hơn bao giờ hết.
Với mật độ xây dựng thấp chỉ 41,5%, Dreamland Bonanza phát triển hệ thống cảnh quan xanh tại khu căn hộ, mang đến không gian sống tiêu chuẩn Singapore. Các căn hộ đều được lắp đặt thiết bị hệ thống đèn tiết kiệm năng lượng, các sản phẩm bền vững và thân thiện với môi trường.
Sở hữu hơn 20 tiện ích nội khu, cư dân Dreamland Bonanza sẽ được trải nghiệm những gì ngay trong chính chung cư của mình?
Hệ thống sân tập bóng rổ, sân tập tennis, sân đánh golf trong nhà.
Sân chơi trẻ em, đường dạo bộ ngoài trời.
Bể bơi liên hoàn, phòng tập gym đa tính năng.
Hệ thống bãi đỗ xe thông minh.
Siêu thị, cửa hàng tiện ích, chuỗi nhà hàng, cafe,...
Bể bơi trong nhà tại chung cư Dreamland Bonanza (nguồn: Đất Xanh Miền Bắc)
Chung cư Dreamland Bonanza Cầu Giấy cung cấp cho thị trường bất động sản nhiều loại căn hộ đa dạng kích thước và diện tích, chủ yếu là các căn từ 2 đến 4PN. Các căn hộ này thường phù hợp với gia đình có đông thành viên, chung sống nhiều thế hệ dưới một mái nhà.
Giá bán các căn hộ tại chung cư Dreamland Bonanza Duy Tân phụ thuộc vào vị trí và Cụ thể diện tích các căn hộ này ra sao, và giá bán hiện tại của căn hộ chung cư Dreamland Bonanza quận Cầu Giấy là bao nhiêu?
Trên đây là tổng hợp thông tin từ OneHousing về chung cư D.reamland Bonanza quận Cầu Giấy cũng như diện tích các căn hộ 2 - 4PN thuộc dự án này. Hi vọng với những chia sẻ hữu ích trên đây, bạn đã có cho mình sự lựa chọn phù hợp để sở hữu không gian sống lý tưởng tại Dreamland.
Bài viết chỉ mang tính chất tham khảo, OneHousing không chịu trách nhiệm về những trường hợp tự ý áp dụng mà không có sự tư vấn của Pro Agent."
https://onehousing.vn/blog/gia-thue-can-ho-3-phong-ngu-dat-nhat-quan-9-tp-thu-duc-dang-la-bao-nhieu-n17t,"Giá thuê căn hộ 3 phòng ngủ đắt nhất quận 9, TP Thủ Đức đang là bao nhiêu?",2023-06-07,2023-06-11 00:00:00-06:00,"Giá thuê căn hộ 3 phòng ngủ đắt nhất quận 9, TP Thủ Đức đang là bao nhiêu?
Khám phá thị trường cho thuê chung cư tại quận 9, TP Thủ Đức và tìm hiểu chung cư cho thuê căn hộ 3 phòng ngủ đắt nhất là bao nhiêu qua bài chia sẻ ngay sau đây.
Quận 9, TP Thủ Đức là một trong những khu vực phát triển nhanh chóng và sôi động nhất TP.HCM. Nơi đây có nhiều dự án căn hộ mới và chất lượng, thu hút nhiều khách hàng có nhu cầu thuê căn hộ cao cấp. Vậy hãy cùng OneHousing tìm hiểu chung cư cho thuê căn hộ 3 phòng ngủ đắt nhất quận 9, TP Thủ Đức đang là bao nhiêu, qua bài chia sẻ sau.
Thông tin tổng quan về quận 9, TP Thủ Đức
Quận 9 là một điểm đến đầy hứa hẹn và khát vọng tương lai. Với diện tích khoảng 114 km2 và 13 phường, Quận 9 là nơi thăng hoa của sự tiến bộ và đổi mới. Quận có vị trí địa lý thuận lợi, giáp ranh với những quận lân cận như: quận 2, Thủ Đức và quận Long Thành, huyện Nhơn Trạch thuộc tỉnh Đồng Nai.
Đây cũng là khu vực tập trung nhiều khu công nghiệp hiện đại, khu đô thị mới đầy sức sống và những trường đại học hàng đầu như Đại học Quốc gia TP Hồ Chí Minh, Đại học Sư phạm Kỹ thuật TP Hồ Chí Minh và Đại học FPT. Ngoài ra, quận 9 còn sở hữu nhiều điểm đến thú vị, như:
Công viên Suối Tiên: Không chỉ là một công viên giải trí, Suối Tiên là một thế giới thần tiên được khơi nguồn từ câu chuyện cổ tích và lịch sử Việt Nam.
Khu du lịch Bửu Long: Đắm mình trong không gian thiên nhiên tuyệt đẹp của khu du lịch Bửu Long, bạn sẽ được thả hồn giữa cảnh quan hùng vĩ.
Khu du lịch Văn Thánh: Với không gian rộng lớn hơn 20 ha, khu du lịch Văn Thánh là nơi thỏa sức tận hưởng vẻ đẹp của thiên nhiên. Cây sen, hoa mai và hoa lan tỏa hương thơm ngọt ngào, tạo nên một bức tranh tươi đẹp
Căn hộ 3 phòng ngủ tại quận 9 phù hợp với đối tượng nào?
Căn hộ 3 phòng ngủ tại quận 9 sẽ là sự lựa chọn tuyệt vời với những đối tượng nào sau đây:
Những gia đình có nhu cầu ở rộng rãi, thoải mái và tiện nghi, với không gian riêng biệt cho từng thành viên. Căn hộ 3 phòng ngủ có diện tích từ 81m2 đến 108m2, được thiết kế đẹp mắt, tối ưu lợi thế tầm nhìn và ánh sáng tự nhiên.
Những người làm việc tại khu công nghệ cao quận 9 hoặc các khu vực lân cận như quận Thủ Đức, quận 2, Biên Hòa hay Dĩ An. Căn hộ 3 phòng ngủ tại quận 9 có vị trí thuận lợi, dễ dàng di chuyển qua các tuyến đường huyết mạch như xa lộ Hà Nội, cao tốc Long Thành - Dầu Giây hay Vành đai .
Những người yêu thích cuộc sống xanh, trong lành và hiện đại, với nhiều tiện ích cao cấp và an ninh tốt. Căn hộ 3 phòng ngủ tại quận 9 nằm trong các dự án chung cư uy tín và chất lượng như Vinhomes Grand Park, Gem Riverside hay Ricca. Nơi đây có nhiều khuôn viên cây xanh, hồ bơi, công viên, trường học, bệnh viện, trung tâm thương mại và khu vui chơi giải trí
Các dự án cho thuê căn hộ 3 phòng ngủ tại quận 9
Theo trang website batdongsan vào T5/2023, dưới đây là một số dự án căn hộ 3 phòng ngủ nổi bật đang cho thuê tại quận 9, TP Thủ Đức.
Không gian sống rộng rãi, thoải mái và tiện nghi: Căn hộ chung cư 3 phòng ngủ có diện tích từ 81m2 đến 108m2, được thiết kế đẹp mắt, tối ưu lợi thế tầm nhìn và ánh sáng tự nhiên.
Vị trí thuận lợi, dễ dàng di chuyển qua các tuyến đường huyết mạch như xa lộ Hà Nội, cao tốc Long Thành - Dầu Giây hay Vành đai 3. Bạn có thể tiết kiệm thời gian và chi phí khi đi làm hay đi học tại các khu vực lân cận.
Căn hộ chung cư 3 phòng ngủ tại quận 9 nằm trong các dự án chung cư uy tín và chất lượng như Vinhomes Grand Park, Gem Riverside hay Ricca. Nơi đây có nhiều khuôn viên cây xanh, hồ bơi, công viên, trường học, bệnh viện, trung tâm thương mại và khu vui chơi giải trí. Bạn sẽ được tận hưởng cuộc sống xanh, trong lành và hiện đại, với nhiều hoạt động giải trí và thư giãn cho bạn và gia đình.
Chi phí thuê hợp lý, linh hoạt: Căn hộ chung cư 3 phòng ngủ tại quận 9 có chi phí thuê hợp lý và linh hoạt. Bạn có thể lựa chọn căn hộ theo nhu cầu, khả năng của mình và gia đình.
The Origami - Vinhomes Grand Park, phân khu căn hộ thứ hai tại Khu đô thị Vinhomes Grand Park, một dự án được Tập đoàn Vingroup và Tập đoàn Mitsubishi (Nhật Bản) cùng nhau triển khai. Với quy mô 21 toà nhà và hơn 12.000 căn hộ cao cấp, The Origami mang đậm chất tinh thần văn hoá đất nước xứ sở hoa Anh Đào - Nhật Bản. Tại The Origami, bạn sẽ được trải nghiệm không chỉ những căn hộ cao cấp đẳng cấp, mà còn một cộng đồng sống đầy độc đáo và tinh tế. Từ quy hoạch đồng bộ của hệ thống tiện ích ""All in one"" đến nền tảng quản lý vận hành thông minh, mọi thứ đã được chuẩn bị kỹ lưỡng để mang đến cho cư dân của Vinhomes Grand Park những trải nghiệm sống mới chưa từng có.
The Origami - Vinhomes Grand Park có nhiều loại hình sản phẩm để bạn lựa chọn, từ căn hộ Studio cho người độc thân hay vợ chồng trẻ, đến căn hộ 1PN, 2PN, 3PN cho gia đình có con nhỏ hay người già. Diện tích căn hộ dao động từ 27m2 đến 108m2, được thiết kế hiện đại, tinh tế và tiện nghi. Bạn sẽ có không gian sống thoải mái và sang trọng, với phòng khách, phòng bếp, phòng ngủ và phòng vệ sinh rộng rãi và thoáng mát. Bạn cũng có thể trang trí căn hộ theo sở thích của mình, để tạo ra một không gian sống ấm cúng và cá tính.
The Origami Vinhomes Grand Park - Nét đẹp tuyệt vời của văn hóa Nhật Bản trong lòng thành phố (Nguồn: Vinhomes)
The Origami - Vinhomes Grand Park có nhiều tiện ích nội khu để bạn tận hưởng cuộc sống xanh, trong lành và hiện đại. Bạn sẽ được ngắm nhìn khu vườn Nhật Bản xinh xắn với hồ cá Koi, cây bonsai và cầu gỗ. Bạn sẽ được mua sắm và giải trí tại khu thương mại sầm uất với nhiều cửa hàng, nhà hàng và rạp chiếu phim. Bạn sẽ được rèn luyện sức khỏe và thư giãn tại công viên cầu vồng với hồ bơi, sân tennis, sân bóng rổ và khu vui chơi trẻ em. Bạn sẽ được an tâm về việc học tập và chăm sóc sức khỏe cho gia đình tại trường học Vinschool, bệnh viện Vinmec,...
Hy vọng qua bài viết này, bạn đã hiểu rõ hơn về chung cư cho thuê căn hộ 3 phòng ngủ đắt nhất quận 9, TP Thủ Đức. Đây là một khu vực đang phát triển mạnh, có nhiều tiện ích và cơ hội việc làm. Nếu bạn muốn sống trong một không gian xanh, trong lành và hiện đại, bạn không nên bỏ qua các dự án căn hộ chất lượng tại đây.
Bài viết chỉ mang tính chất tham khảo, OneHousing không chịu trách nhiệm về những trường hợp tự ý áp dụng mà không có sự tư vấn trực tiếp của Pro Agent."
http://hanoimoi.com.vn/tin-tuc/Y-kien/1066522/lam-gi-de-phong-chong-duoi-nuoc-tai-ho-tan-xa-huyen-thach-that,"Làm gì để phòng chống đuối nước tại hồ Tân Xã, huyện Thạch Thất?",,2023-06-11 00:00:00+07:00,"(HNMO) - Những năm gần đây, hầu như năm nào hồ Tân Xã nằm trong Khu công nghệ cao Hòa Lạc (huyện Thạch Thất) cũng xảy ra tai nạn đuối nước. Thế nhưng, bất chấp cảnh báo nguy hiểm, người dân, đặc biệt là trẻ em ở các xã lân cận vẫn cố tình bơi lội ở khu vực nguy hiểm dù đã có biển “cấm bơi”. Làm thế nào để phòng chống đuối nước tại hồ Tân Xã là câu hỏi cần sớm có lời giải khi nhu cầu bơi lội của nhân dân vào mùa hè rất lớn.
Hồ Tân Xã là hồ tự nhiên, trước đây thuộc địa giới hành chính của xã Tân Xã (huyện Thạch Thất). Thực hiện Quyết định số 404/QĐ-UBND ngày 9-4-2002 của UBND tỉnh Hà Tây cũ (nay là thành phố Hà Nội) về việc thu hồi 1.298,86ha đất thuộc các xã: Tân Xã, Hạ Bằng, Thạch Hòa, Bình Yên (huyện Thạch Thất) để giao cho Ban Quản lý khu công nghệ cao Hòa Lạc quản lý, thực hiện các dự án đầu tư xây dựng, hồ Tân Xã nằm trong ranh giới thực hiện Dự án khu công nghệ cao Hòa Lạc. Hiện, xung quanh hồ Tân Xã đã được xây kè, làm đường dạo xung quanh, trồng cây xanh…, tạo cảnh quan xanh, sạch, đẹp. Hằng năm, vào mùa hè, rất đông người dân ở các lứa tuổi, trong đó chủ yếu là trẻ em đã đến hồ Tân Xã bơi lội, biến nơi đây thành “bãi tắm” tự phát của huyện Thạch Thất.
Bất chấp cảnh báo, nhiều người dân vẫn bơi lội ở khu vực nước sâu nguy hiểm.
Về vấn đề này, Phó Chánh Văn phòng, Ban Quản lý khu công nghệ cao Hòa Lạc Bùi Tuấn Khanh cho biết, mặc dù Ban thường xuyên kiểm tra, nhắc nhở, cắm biển cảnh báo khu vực nước sâu nguy hiểm cấm bơi, nhưng nhiều người dân vẫn cố tình bơi lội ở những nơi nước sâu, đặc biệt không sử dụng phao, dụng cụ nổi; trẻ em tắm, bơi tự do khi thiếu kỹ năng phòng chống đuối nước, thiếu sự giám sát, quản lý của người lớn, nên hầu như năm nào tại hồ Tân Xã cũng xảy ra các vụ đuối nước thương tâm. Nạn nhân chủ yếu trong độ tuổi thanh, thiếu niên.
Nhiều biển cấm bơi đã được cắm quanh hồ Tân Xã nhưng người dân vẫn... xuống tắm.
Vụ đuối nước thương tâm xảy ra vào ngày 5-6 vừa qua tại hồ Tân Xã cướp đi sinh mạng của một học sinh là một điển hình của tình trạng nói trên. Theo ông Bùi Tuấn Khanh, sau khi nhận được tin báo, Ban Quản lý đã chủ động liên hệ với các lực lượng chức năng của huyện, các xã lân cận tham gia tìm kiếm cứu nạn. Do nạn nhân bị đuối nước ở khu vực nước sâu nên việc tìm kiếm cứu nạn gặp nhiều khó khăn. Đến 22h45 cùng ngày, các lực lượng mới tìm thấy nạn nhận là em K.K.H, sinh năm 2007, xã Cần Kiệm (huyện Thạch Thất).
Trước đó vào mùa hè năm 2022, tại hồ Tân Xã cũng xảy ra vụ đuối nước, cướp đi sinh mạng của 1 nam sinh viên Trường Đại học FPT nằm trong khu công nghệ cao Hòa Lạc.
Thực tế tại khu vực đập Quán Trăn (thuộc hồ Tân Xã) vào khoảng 15h30 ngày 6-6, một ngày sau vụ đuối nước gần nhất, phóng viên Báo Hànộimới ghi nhận vẫn có người xuống hồ bơi ở một số điểm đã được cảnh báo nguy hiểm.
Khi được hỏi tại sao mọi người vẫn xuống bơi, bất chấp biển cảnh báo, một người phụ nữ trung tuổi ở xã Hạ Bằng (huyện Thạch Thất) chuẩn bị xuống hồ bơi, cho biết: “Chúng tôi sử dụng phao khi xuống bơi nên không lo đuối nước…”. Quan sát tại một số điểm khác quanh hồ Tân Xã, cũng có nhiều người xuống bơi lội. Nhiều hàng quán cho thuê phao, dụng cụ nổi, bán nước... cũng ngang nhiên chiếm đường dạo ven hồ để bày bán.
Nhiều dịch vụ ""ăn theo"" xuất hiện tại hồ Tân Xã.
Nói về hồ Tân Xã, Chủ tịch UBND xã Tân Xã Trần Văn Hòa thông tin, mấy năm gần đây, số người dân đến vui chơi, cắm trại, tham quan tại hồ rất đông. Vào mùa hè, nhất là những ngày nắng nóng, hàng trăm người từ nhiều địa phương trong huyện đến đây để tắm, bơi lội. Do hồ thuộc quyền quản lý của Ban quản lý khu công nghệ cao Hòa Lạc, nên để phòng chống đuối nước, những năm gần đây, UBND xã liên tục có văn bản đề nghị Ban lắp biển cảnh báo vùng nước sâu cấm bơi; kiểm tra, nhắc nhở, không cho người dân xuống tắm… Nhưng do hồ quá rộng, ý thức người dân còn hạn chế, nên bất chấp cảnh báo, nhiều người dân vẫn xuống hồ bơi lội.
Được biết, trước thực trạng trên, Ban Quản lý Khu công nghệ cao Hòa Lạc tiếp tục phối hợp với UBND các xã lân cận đẩy mạnh công tác tuyên truyền, nâng cao ý thức cho người dân về phòng chống đuối nước, tuyệt đối không bơi lội tại hồ Tân Xã. Bên cạnh đó, cũng đề nghị huyện Thạch Thất tăng cường tổ chức các lớp dạy bơi cho nhân dân, phổ cập bơi cho trẻ em, chú trọng truyền thông, phổ biến kiến thức, kỹ năng về phòng chống đuối nước trẻ em.
“Khó khăn lớn nhất ở đây là hồ rộng, khoảng 150ha (mùa mưa) và 85ha (mùa cạn); lực lượng bảo vệ của khu công nghệ cao Hoà Lạc mỏng, chỉ tuyên truyền, nhắc nhở, không được xử phạt, trong khi ý thức người dân chưa cao nên công tác quản lý gặp khó khăn. Do đó, để phòng chống triệt để nạn đuối nước cần sự vào của chính quyền các xã lân cận, đặc biệt là ý thức của người dân. Chỉ khi nào ý thức của người dân được nâng lên mới có thể phòng chống được đuối nước tại hồ Tân Xã”, ông Bùi Tuấn Khanh nhấn mạnh.
Bản quyền thuộc Báo Hànộimới - Cơ quan chủ quản: Thành ủy Hà Nội
Giấy phép số 69/GP-BTTTT, Bộ Thông tin và Truyền thông cấp ngày 20/02/2023.
Địa chỉ: 44 Lê Thái Tổ, phường Hàng Trống, Hoàn Kiếm, Hà Nội. ĐT (024) 38253067 – 39287445"
